<?xml version="1.0" encoding="UTF-8"?>
<!--W3C Schema generated by XMLSpy v2008 rel. 2 sp2 (http://www.altova.com)-->
<xs:schema xmlns:xs="http://www.w3.org/2001/XMLSchema">
	<xs:element name="username" type="xs:string"/>
	<xs:element name="smtp">
		<xs:complexType>
			<xs:sequence>
				<xs:element ref="host"/>
				<xs:element ref="port"/>
				<xs:element ref="username"/>
				<xs:element ref="password"/>
				<xs:element ref="from"/>
				<xs:element ref="subject"/>
				<xs:element ref="msgTemplate"/>
			</xs:sequence>
		</xs:complexType>
	</xs:element>
	<xs:element name="settings">
		<xs:complexType>
			<xs:sequence>
				<xs:element ref="smtp"/>
				<xs:element ref="notifications"/>
				<xs:element ref="report"/>
			</xs:sequence>
		</xs:complexType>
	</xs:element>
	<xs:element name="servers">
		<xs:complexType>
			<xs:sequence>
				<xs:element ref="server" maxOccurs="unbounded"/>
			</xs:sequence>
		</xs:complexType>
	</xs:element>
	<xs:element name="server">
		<xs:complexType>
			<xs:sequence>
				<xs:element ref="hostName"/>
				<xs:element ref="port"/>
				<xs:element ref="contextRoot"/>
				<xs:element ref="protocol"/>
				<xs:element ref="authconfig"/>
			</xs:sequence>
		</xs:complexType>
	</xs:element>
	<xs:element name="report">
		<xs:complexType>
			<xs:sequence>
				<xs:element ref="name"/>
				<xs:element ref="format"/>
			</xs:sequence>
		</xs:complexType>
	</xs:element>
	<xs:element name="protocol" type="xs:string"/>
	<xs:element name="port" type="xs:int"/>
	<xs:element name="password" type="xs:string"/>
	<xs:element name="notifications">
		<xs:complexType>
			<xs:sequence>
				<xs:element ref="interval"/>
				<xs:element ref="emails"/>
			</xs:sequence>
		</xs:complexType>
	</xs:element>
	<xs:element name="name" type="xs:string"/>
	<xs:element name="interval" type="xs:int"/>
	<xs:element name="hostName" type="xs:string"/>
	<xs:element name="host" type="xs:string"/>
	<xs:element name="from" type="xs:string"/>
	<xs:element name="format" type="xs:string"/>
	<xs:element name="emails" type="xs:string"/>
	<xs:element name="contextRoot" type="xs:string"/>
	<xs:element name="subject" type="xs:string"/>
	<xs:element name="msgTemplate" type="xs:string"/>
	<xs:element name="config">
		<xs:complexType>
			<xs:sequence>
				<xs:element ref="servers"/>
				<xs:element ref="settings"/>
			</xs:sequence>
		</xs:complexType>
	</xs:element>
	<xs:element name="param">
		<xs:complexType>
			<xs:attribute name="value" use="required" type="xs:string"/>
			<xs:attribute name="name" use="required" type="xs:string"/>
		</xs:complexType>
	</xs:element>	
	<xs:element name="authconfig">
		<xs:complexType>
			<xs:sequence>
				<xs:element ref="param" minOccurs="0" maxOccurs="unbounded"/>
			</xs:sequence>
		</xs:complexType>
	</xs:element>	
</xs:schema>
