<?xml version="1.0" encoding="UTF-8"?>
<config xmlns:xsi="http://www.w3.org/2001/XMLSchema-instance" xsi:noNamespaceSchemaLocation="config.xsd">
	<servers>
		<server>
			<hostName>sunny.fors.ru</hostName>
			<port>80</port>
			<contextRoot>archiva</contextRoot>
			<protocol>http</protocol>
			<authconfig/>
		</server>
		<server>
			<hostName>sunny.fors.ru</hostName>
			<port>80</port>
			<contextRoot>jenkins</contextRoot>
			<protocol>http</protocol>
			<authconfig>
				<param name="j_username" value="sahmed"/>
				<param name="j_password" value="qwer$321"/>
			</authconfig>
		</server>
		<server>
			<hostName>sunny.fors.ru</hostName>
			<port>80</port>
			<contextRoot>sonar11</contextRoot>
			<protocol>http</protocol>
			<authconfig>
				<param name="login" value="sahmed"/>
				<param name="password" value="qwer4321"/>
				<param name="commit" value="Log+in"/>
				<param name="remember_me" value="1"/>
			</authconfig>
		</server>
	</servers>
	<settings>
		<smtp>
			<host>172.27.0.3</host>
			<port>25</port>
			<username>fdcadmin</username>
			<password>DulunsAdvu</password>
			<from>fdcadmin@fors.ru</from>
			<subject>Уведомление об отказе сервера sunny</subject>
			<msgTemplate>Некоторые сервреы вышли из строй на сервер sunny.fors.ru.</msgTemplate>
		</smtp>
		<notifications>
			<interval>10</interval>
			<emails>sahmed@fors.ru</emails>
		</notifications>
		<report>
			<name>report.html</name>
			<format>html</format>
		</report>
	</settings>
</config>
